{"$schema":"schemas/v1/protocol.schema.json","protocol_id":"proto-20260908-ai-research-harnesses-trust","created_at":"2026-09-08T08:00:00+00:00","project_slug":"ai-research-harnesses-trust","playbook_type":"SCOPING_REVIEW","metadata":{"lead_researcher":"Mouadh & AI Agent","target_venue_type":"ACM JCDL / EMNLP / CSCW (top-tier CS)","timeline_weeks":4,"title":"AI-Assisted Academic Research Harnesses: Traceability, Trust, Audit and Reproducibility"},"epistemology":{"primary_paradigm":"Design Science","secondary_paradigm":"Positivist","unit_of_analysis":"academic research and literature review harness systems","trustworthiness_framework":"JBI Scoping Review Framework (PRISMA-ScR)","epistemological_rationale":"Design Science stance via the SCOPING_REVIEW playbook. Unit of analysis: academic research and literature review harness systems. Convincing evidence consists of concrete, published descriptions or evaluations of AI-assisted research harnesses reporting explicit mechanisms for execution provenance, audit trails, evidence verification, or reproducibility. Explicitly out of scope: generic writing assistants without research workflow orchestration, non-scholarly enterprise RAG, and purely narrative position papers without an artifact or evaluation.","incompatible_concepts":["Pure writing assistants (Grammarly, Paperpal, generic ChatGPT prompts)","Non-scholarly enterprise RAG / generic conversational search","Narrative opinion essays lacking system architecture or evaluation"]},"research_questions":[{"id":"RQ1","text":"What is the state of the art in academic research and literature review harnesses that integrate LLMs and agentic AI (2023\u20132026), and what concrete design mechanisms do they implement for execution provenance, audit trails, and process reproducibility?","target_facet":"architecture_and_provenance","synthesis_type":"Comparative Matrix","required_evidence_type":"Architectural specifications, workflow descriptions, provenance logging models"},{"id":"RQ2","text":"What evidence-trust and academic-integrity mechanisms (e.g., citation fact-checking, hallucination mitigation, retraction checks, risk-of-bias, and open-science artifact verification) are incorporated into modern AI research harnesses?","target_facet":"trust_and_integrity_mechanisms","synthesis_type":"Comparative Matrix","required_evidence_type":"Algorithmic descriptions of citation verification, hallucination mitigation, or integrity auditing layers"},{"id":"RQ3","text":"How are AI-assisted research harnesses empirically evaluated (benchmarks, ablations, inter-rater reliability, user studies), and what architectural gaps remain for the construction of a novel, trustworthy research infrastructure?","target_facet":"empirical_evaluations_and_gaps","synthesis_type":"Narrative & Gap Analysis","required_evidence_type":"Quantitative benchmark evaluations (accuracy, recall, precision, latency) and documented architectural limitations"}],"search_strategy":{"core_concepts":[{"concept":"research harness","synonyms":["literature review tool","systematic review automation","scholarly workflow","evidence synthesis platform","academic literature RAG"],"boolean_operator":"OR"},{"concept":"AI assistance","synonyms":["large language model","LLM","agentic AI","AI agent","generative AI","retrieval-augmented generation"],"boolean_operator":"OR"},{"concept":"traceability & audit","synonyms":["provenance","audit trail","audit ledger","reproducibility","process transparency"],"boolean_operator":"OR"},{"concept":"trust & integrity","synonyms":["trustworthiness","verification","hallucination mitigation","citation accuracy","retraction check","risk of bias","open science"],"boolean_operator":"OR"}],"target_databases":["openalex","semantic_scholar","arxiv","crossref","pubmed","dblp"],"date_range":{"end_year":2026,"start_year":2023},"languages":["en"],"open_access_preferred":false,"target_candidate_pool_size":{"max":60,"min":30}},"screening_criteria":{"inclusion":[{"id":"INC-01","criterion":"Proposes, implements, or evaluates a computational tool, system, harness, or multi-agent pipeline specifically designed for academic literature discovery, screening, extraction, citation graph analysis, or evidence synthesis.","maps_to_rqs":["RQ1","RQ2","RQ3"],"reason_category":null},{"id":"INC-02","criterion":"Incorporates Large Language Models (LLMs), agentic orchestration, or modern RAG mechanisms within the scientific literature workflow.","maps_to_rqs":["RQ1","RQ2","RQ3"],"reason_category":null},{"id":"INC-03","criterion":"Explicitly describes or evaluates mechanisms for execution provenance (audit logs, DAG pipelines), citation verification / hallucination mitigation, or academic integrity (retraction, risk-of-bias, or open-science checks).","maps_to_rqs":["RQ1","RQ2"],"reason_category":null},{"id":"INC-04","criterion":"Provides an accessible codebase, architecture specification, or quantitative empirical evaluation (e.g., precision, recall, citation accuracy, benchmark metrics, or user study).","maps_to_rqs":["RQ2","RQ3"],"reason_category":null}],"exclusion":[{"id":"EXC-01","criterion":"Pure academic writing, paraphrasing, grammar, or paper-authorship tools (e.g., Paperpal, generic ChatGPT writing prompts) lacking literature workflow orchestration or provenance.","maps_to_rqs":["RQ1","RQ2","RQ3"],"reason_category":"PURE_WRITING_TOOL"},{"id":"EXC-02","criterion":"General-purpose conversational RAG or enterprise search systems not specifically targeted to academic research or scientific literature.","maps_to_rqs":["RQ1","RQ2","RQ3"],"reason_category":"NON_SCHOLARLY_DOMAIN"},{"id":"EXC-03","criterion":"Narrative opinion pieces, commentaries, or high-level philosophical manifestos lacking a described system architecture or empirical evaluation.","maps_to_rqs":["RQ1","RQ2","RQ3"],"reason_category":"NO_COMPUTATIONAL_ARTIFACT"},{"id":"EXC-04","criterion":"Published prior to 2023 (excluding pre-LLM historical literature).","maps_to_rqs":["RQ1","RQ2","RQ3"],"reason_category":"TEMPORAL_OUT_OF_BOUNDS"},{"id":"EXC-05","criterion":"Full text not available in English.","maps_to_rqs":["RQ1","RQ2","RQ3"],"reason_category":"NON_ENGLISH"}],"two_tier_screening":true},"matrix_dimensions":[{"id":"artifact_name","name":"System / Artifact Name & Availability","description":"System name, open-source repository URL, license, and interface (CLI, Web UI, API)","target_section_category":"methodology","data_type":"free_text","required":true,"fallback_value":"Not Reported"},{"id":"workflow_stages","name":"Automated Research Stages","description":"Stages automated, using standard vocabulary: Discovery, Deduplication, Screening, PDF Harvest, AST Extraction, Synthesis, Citation Graph. Free-text with checklist vocabulary for tabulation.","target_section_category":"methodology","data_type":"free_text","required":true,"fallback_value":"Not Reported"},{"id":"ai_agent_architecture","name":"AI / LLM Architecture","description":"Multi-label classification of orchestration pattern and model backends.","target_section_category":"methodology","data_type":"list","required":true,"fallback_value":"Not Reported"},{"id":"traceability_mechanism","name":"Provenance & Audit Mechanism","description":"Execution provenance: append-only journal, DAG execution, PROV-O, versioned artifact store","target_section_category":"methodology","data_type":"free_text","required":true,"fallback_value":"Not Reported"},{"id":"provenance_maturity","name":"Provenance Maturity Level","description":"Ordinal maturity classification of the system's provenance and auditability.","target_section_category":"methodology","data_type":"categorical","required":true,"fallback_value":"L0"},{"id":"trust_layers","name":"Evidence Trust & Integrity Layers","description":"Citation grounding, hallucination scoring, retraction check, RoB, open science DAS/CAS","target_section_category":"methodology","data_type":"free_text","required":true,"fallback_value":"Not Reported"},{"id":"evidence_availability","name":"Evidence Availability","description":"Categorical classification of what reproducibility artifacts the paper provides.","target_section_category":"methodology","data_type":"categorical","required":true,"fallback_value":"none"},{"id":"provenance_standard_compliance","name":"Provenance Standard Compliance","description":"Whether the system claims or implements compliance with formal provenance or research integrity standards.","target_section_category":"methodology","data_type":"free_text","required":false,"fallback_value":"None claimed"},{"id":"evaluation_benchmark","name":"Evaluation Methodology & Metrics","description":"Benchmark datasets, precision, recall, F1, citation accuracy %, hallucination rate, latency","target_section_category":"results_empirical","data_type":"free_text","required":false,"fallback_value":"Not Reported"},{"id":"open_gaps","name":"Reported Limitations & Open Gaps","description":"Author-reported limitations and unaddressed architectural challenges","target_section_category":"discussion_limitations","data_type":"free_text","required":false,"fallback_value":"Not Reported"}],"verification":{"retraction_check_required":true,"coi_and_funding_audit_required":true,"reproducibility_das_cas_check":true,"minimum_trust_score_threshold":6.0}}